{
  "schemaVersion": "2026-06-05.research.deep-research-student-archive-projection-review-recorded.v1",
  "runtimeId": "research_deep_research_student_archive_projection_review_runtime",
  "commandPort": "DeepResearchStudentArchiveProjectionReviewPort.recordStudentArchiveProjectionReview",
  "status": "STUDENT_ARCHIVE_PROJECTION_REVIEW_APPROVED_NOT_WRITTEN",
  "recordId": "research_deep_research_student_archive_projection_review_deep-research-student-archive-projection-review_job-001",
  "recordedAt": "2026-06-05T00:00:00.000Z",
  "idempotencyKey": "deep-research-student-archive-projection-review:job-001",
  "idempotentReplay": false,
  "job": {
    "taskId": "agent_task_research_deep_001",
    "contextRef": "shared_ctx_research_deep_001",
    "jobId": "deep_research_job_001",
    "queueName": "research_deep_research"
  },
  "studentArchiveProjectionReview": {
    "reviewId": "deep_research_student_archive_projection_review_001",
    "reviewKind": "DURABLE_STUDENT_ARCHIVE_PROJECTION_REVIEW",
    "decision": "APPROVED_FOR_DURABLE_STUDENT_ARCHIVE_PROJECTION_RUNTIME",
    "projectionState": "REVIEWED_NOT_PROJECTED_TO_STUDENT_ARCHIVE",
    "targetArchiveKind": "STUDENT_LEARNING_ARCHIVE",
    "archiveScopeRef": "classroom_scope:grade8:math:unit-personalized-learning",
    "sourcePersistenceRecordId": "research_deep_research_student_archive_persistence_deep-research-student-archive-persistence_job-001",
    "sourcePersistenceCommandId": "deep_research_student_archive_persistence_command_001",
    "sourceStudentDeliveryRecordId": "research_deep_research_student_delivery_deep-research-student-delivery_job-001",
    "sourceStudentDeliveryEnvelopeId": "deep_research_student_delivery_envelope_001",
    "studentVisibilityReviewId": "deep_research_student_visibility_review_001",
    "teacherDeliveryPackageId": "deep_research_teacher_delivery_package_001",
    "reviewerPrincipalId": "teacher_research_reviewer_001",
    "comments": "Projection review approved for future durable runtime only.",
    "title": "Evidence grounded learning support draft",
    "learnerFacingSummary": "The reviewed draft can be shown to the approved student app scope while archive projection waits for a separate runtime.",
    "claimCount": 1,
    "citationCount": 1,
    "sourceHashCount": 1,
    "claims": [
      {
        "claimId": "claim_001",
        "text": "Personalized learning support needs traceable evidence and explicit learning outcomes.",
        "citations": ["public_curriculum_knowledge#source:public-curriculum:001"],
        "sourceHashes": ["sha256:aaaaaaaaaaaaaaaaaaaaaaaaaaaaaaaaaaaaaaaaaaaaaaaaaaaaaaaaaaaaaaaa"],
        "supportChunkIds": ["chunk_public_001"],
        "confidence": 0.82,
        "evidencePreserved": true
      }
    ],
    "limitations": ["This archive command is not the final durable student archive row."],
    "risk": {
      "hallucinationRisk": "LOW",
      "privateKnowledgeRisk": "LOW",
      "studentDataRisk": "LOW",
      "publicationRisk": "LOW"
    },
    "approvedForFutureDurableProjection": true,
    "revisionRequired": false,
    "evidencePreserved": true,
    "sourceHashIntegrityPreserved": true,
    "limitationsPreserved": true
  },
  "evidenceRefs": [
    "evidence:student-archive-projection-review:human-approved",
    "evidence:student-archive-persistence:job-001",
    "evidence:student-archive-projection-review-input-hash:sha256:cccccccccccccccccccccccccccccccccccccccccccccccccccccccccccccccc",
    "evidence:runtime:research_deep_research_student_archive_projection_review_runtime",
    "evidence:command-port:DeepResearchStudentArchiveProjectionReviewPort.recordStudentArchiveProjectionReview",
    "evidence:student-archive-persistence-record:research_deep_research_student_archive_persistence_deep-research-student-archive-persistence_job-001"
  ],
  "boundary": {
    "studentArchivePersistenceCommandVerified": true,
    "humanProjectionReviewRecorded": true,
    "approvedForFutureDurableProjection": true,
    "appendOnlyReviewLogRecorded": true,
    "evidenceIntegrityPreserved": true,
    "sourceHashIntegrityPreserved": true,
    "limitationsPreserved": true,
    "studentAudienceScopeEnforced": true,
    "studentArchivePersisted": false,
    "studentArchiveProjectionWritten": false,
    "finalAnswerPublished": false,
    "publicationCandidateCreated": false,
    "directPublicationAllowed": false,
    "externalModelCallStarted": false,
    "mainDatabaseWriteStarted": false,
    "studentArchiveWriteStarted": false,
    "remoteDeviceControlAllowed": false,
    "localToolMutationAllowed": false,
    "swarmAllowed": false,
    "requiresFutureDurableProjectionRuntime": true
  },
  "runtimeSlo": {
    "targetP99Ms": 300,
    "evidenceClass": "ASYNC_DEEP_RESEARCH_STUDENT_ARCHIVE_PROJECTION_REVIEW_BOUNDARY"
  },
  "nextAction": "Use this review as authorization evidence only; durable student archive projection remains a separate runtime."
}
